<!--
    pythonpoint.dtd

    PythonPoint XML DTD, version 0.1
    Copyright 2001-2002 ReportLab, Inc.
                                          
    This is a draft of the DTD for PythonPoint, a program for creating
    presentation slides based on XML. 

    See http://www.reportlab.com for further information.
                                                             
    Common declaration:

    <?xml version='1.0'?>
    <!DOCTYPE presentation
              PUBLIC "-//ReportLab//DTD PythonPoint XML v0.1//EN"
              "pythonpoint.dtd">

    Please send bug reports, suggestions, etc. to: info@reportlab.com.
-->


<!-- Entities -->

<!ENTITY % bool                   "true|false">
<!ENTITY % align.values           "left|center|right">
<!ENTITY % effectdimension.values "H|V">
<!ENTITY % effectdirection.values "0|90|180|270">
<!ENTITY % effectmotion.values    "I|O">
<!ENTITY % effectname.values      "Blinds|Box|Dissolve|Glitter|Split|Wipe">


<!-- Top-Level Element -->

<!ELEMENT presentation 
              (subject?, title?, author?, section?, stylesheet?, 
              registerFont?, slide*)+>
<!ATTLIST presentation 
              filename CDATA #REQUIRED>


<!-- First-Level Elements -->

<!ELEMENT author (#PCDATA)> <!-- PDF Document Info -->

<!ELEMENT section 
              (fixedimage*, rectangle*, roundrect*, 
              ellipse*, polygon*, line*, string*, 
              infostring*, customshape*, slide*)+>
<!ATTLIST section 
              name CDATA #REQUIRED>

<!ELEMENT slide 
              (fixedimage*, rectangle*, roundrect*, 
              ellipse*, polygon*, line*, string*, 
              infostring*, customshape*, frame*, 
              notes*)+>
<!ATTLIST slide 
              id              CDATA                      #REQUIRED
              title           CDATA                      #REQUIRED
              outlinelevel    NMTOKEN                    #IMPLIED
              showIDName      (%bool;)                   "true"
              effectname      (%effectname.values;)      #IMPLIED
              effectdirection (%effectdirection.values;) "0"
              effectdimension (%effectdimension.values;) "H"
              effectmotion    (%effectmotion.values;)    "I"
              effectduration  NMTOKEN                    "1">

<!ELEMENT stylesheet EMPTY>
<!ATTLIST stylesheet 
              path     CDATA #IMPLIED
              module   CDATA #REQUIRED
              function CDATA #REQUIRED>

<!ELEMENT registerFont EMPTY>
<!ATTLIST registerFont
              name     CDATA #REQUIRED
              path     CDATA #REQUIRED>

<!ELEMENT subject (#PCDATA)> <!-- PDF Document Info -->

<!ELEMENT title (#PCDATA)> <!-- PDF Document Info -->


<!-- Other elements -->

<!ELEMENT b (#PCDATA)>

<!ELEMENT customshape EMPTY>
<!ATTLIST customshape 
              path     CDATA #IMPLIED
              module   CDATA #IMPLIED
              class    CDATA #IMPLIED
              initargs CDATA #IMPLIED
              align    (%align.values;) #IMPLIED>

<!ELEMENT ellipse EMPTY>
<!ATTLIST ellipse 
              x1        NMTOKEN #REQUIRED
              y1        NMTOKEN #REQUIRED
              x2        NMTOKEN #REQUIRED
              y2        NMTOKEN #REQUIRED
              fill      CDATA   #IMPLIED
              stroke    CDATA   "(0,0,0)"
              linewidth NMTOKEN "0">

<!ELEMENT fixedimage EMPTY>
<!ATTLIST fixedimage 
              filename CDATA   #REQUIRED
              x        NMTOKEN #REQUIRED
              y        NMTOKEN #REQUIRED
              width    NMTOKEN #IMPLIED
              height   NMTOKEN #IMPLIED>

<!ELEMENT font (#PCDATA)>
<!ATTLIST font  
              name  CDATA   #IMPLIED
              color CDATA   #IMPLIED
              size  NMTOKEN #IMPLIED>

<!ELEMENT frame 
              (para*, prefmt*, pycode*, image*, table*, 
              fixedimage*, rectangle*, roundrect*, 
              ellipse*, polygon*, line*, string*, 
              customshape*, spacer*)+>
<!ATTLIST frame 
              x            NMTOKEN #REQUIRED
              y            NMTOKEN #REQUIRED
              width        NMTOKEN #REQUIRED
              height       NMTOKEN #REQUIRED
              leftmargin   NMTOKEN "0"
              rightmargin  NMTOKEN "0"
              topmargin    NMTOKEN "0"
              bottommargin NMTOKEN "0"
              border       (%bool;) "false">

<!ELEMENT greek (#PCDATA)>

<!ELEMENT i (#PCDATA)>

<!ELEMENT image EMPTY>
<!ATTLIST image 
              filename CDATA   #REQUIRED   
              width    NMTOKEN #IMPLIED
              height   NMTOKEN #IMPLIED>

<!ELEMENT infostring (#PCDATA)>
<!ATTLIST infostring 
              x     NMTOKEN #REQUIRED
              y     NMTOKEN #REQUIRED
              color CDATA   "(0,0,0)"
              font  CDATA   "Times-Roman"
              size  NMTOKEN "12"
              align (%align.values;) "left">

<!ELEMENT line EMPTY>
<!ATTLIST line 
              x1     NMTOKEN  #REQUIRED
              y1     NMTOKEN  #REQUIRED
              x2     NMTOKEN  #REQUIRED
              y2     NMTOKEN  #REQUIRED
              stroke CDATA    "(0,0,0)"
              width  NMTOKEN  "0">

<!ELEMENT notes para+>

<!ELEMENT para (#PCDATA | i | b | u | super | sub | font | greek)*>
<!ATTLIST para 
              style      CDATA "Normal"
              bullettext CDATA #IMPLIED>

<!ELEMENT polygon EMPTY>
<!ATTLIST polygon 
              points    CDATA   #REQUIRED
              fill      CDATA   #REQUIRED
              stroke    CDATA   "(0,0,0)"
              linewidth NMTOKEN "0">

<!ELEMENT prefmt (#PCDATA)>
<!ATTLIST prefmt 
              style CDATA #IMPLIED>

<!ELEMENT pycode (#PCDATA)>
<!ATTLIST pycode 
              style CDATA #IMPLIED>

<!ELEMENT rectangle EMPTY>
<!ATTLIST rectangle 
              x         NMTOKEN #REQUIRED
              y         NMTOKEN #REQUIRED
              width     NMTOKEN #REQUIRED
              height    NMTOKEN #REQUIRED
              fill      CDATA   #IMPLIED
              stroke    CDATA   "(0,0,0)"
              linewidth NMTOKEN "0">

<!ELEMENT roundrect EMPTY>
<!ATTLIST roundrect 
              x         NMTOKEN #REQUIRED
              y         NMTOKEN #REQUIRED
              width     NMTOKEN #REQUIRED
              height    NMTOKEN #REQUIRED
              fill      CDATA   #IMPLIED
              stroke    CDATA   "(0,0,0)"
              linewidth NMTOKEN "0"
              radius    NMTOKEN "6">

<!ELEMENT spacer EMPTY>
<!ATTLIST spacer 
              height NMTOKEN #REQUIRED>

<!ELEMENT string (#PCDATA)>
<!ATTLIST string 
              x     NMTOKEN #REQUIRED
              y     NMTOKEN #REQUIRED
              color CDATA   "(0,0,0)"
              font  CDATA   "Times-Roman"
              size  NMTOKEN "12"
              align (%align.values;) "left">

<!ELEMENT sub (#PCDATA)>

<!ELEMENT super (#PCDATA)>

<!ELEMENT table (#PCDATA)>
<!ATTLIST table 
              widths   CDATA #IMPLIED
              heights  CDATA #IMPLIED
              style    CDATA #IMPLIED
              colDelim CDATA #IMPLIED
              rowDelim CDATA #IMPLIED>

<!ELEMENT u (#PCDATA)>

